{
  "site_id": "teesta",
  "scenario_id": "teesta__s003",
  "sph_vs_delft3d": {
    "available": true,
    "domain": "nearfield",
    "time_window_s": 3600,
    "metrics": {
      "iou": 0.0,
      "f1_0_3": 0.0,
      "depth_rmse_wet_m": 0.0,
      "velocity_mae_ms": 0.0
    },
    "probes": [
      {
        "poi_id": "teesta__poi__chungthang",
        "arrival_delft3d_s": 0,
        "arrival_sph_s": 0,
        "diff_s": 0
      }
    ],
    "layers": [
      {
        "layer_id": "depth_diff_nearfield",
        "type": "raster_png",
        "url": "/api/v1/files/teesta/runs/teesta__s003__delft3d/summary_nearfield/depth_diff.png",
        "bounds_latlng": [
          [
            27.6,
            88.3
          ],
          [
            28.0,
            88.8
          ]
        ],
        "style_id": "depth_diff",
        "unit": "m",
        "available": true
      }
    ],
    "run_ids": [
      "teesta__s003__delft3d",
      "teesta__s003__sph"
    ]
  },
  "emulator_vs_physics": {
    "available": true,
    "held_out_run_id": "teesta__s012__delft3d",
    "metrics": {
      "iou": 0.0,
      "depth_rmse_wet_m": 0.0,
      "arrival_mae_s": 0.0
    },
    "layers": []
  },
  "gp_vs_linear": {
    "iou_median_gp": 0.0,
    "iou_median_linear": 0.0,
    "arrival_mae_s_gp": 0.0,
    "arrival_mae_s_linear": 0.0
  },
  "when_to_use_key": "when_to_use_sph_delft3d",
  "caveats": [
    {
      "id": "clear_water",
      "severity": "info",
      "text_key": "caveat_clear_water"
    }
  ]
}
